{
  "capabilityHash": "72c456fe941a3aa7224157606fbfccec4a1b7e79e6970e19a28e8fa769c6bb17",
  "computed": {},
  "eventChain": [
    "InstallmentPurchaseFinanced",
    "IssuerFundingDebited",
    "MerchantSettlementCredited",
    "CoreInstallmentFulfillmentReconciled"
  ],
  "inputs": {
    "currency": "EUR",
    "installment_id": "inst-001",
    "issuer_id": "issuer-001",
    "merchant_id": "merchant-001",
    "principal": 5000
  },
  "invariants": [
    "replay_safe",
    "balanced"
  ],
  "kind": "neutrino.test-realization",
  "ledgerDeltas": {
    "issuer.funding": -5000,
    "merchant.settlement": 5000
  },
  "procedure": "core_installment_fulfillment",
  "scenario": "core_installment_fulfillment_happy_path",
  "schemaVersion": 1
}
