{
  "capabilityHash": "d491d163221ad796f606ab2235f083be575dc673517b80eadb76c97cf5979077",
  "computed": {},
  "eventChain": [
    "SponsoredOfferProposed",
    "SponsorCommitmentDebited",
    "MerchantExpectedContributionCredited",
    "CoreRoleConstrainedReconciled"
  ],
  "inputs": {
    "contribution": 5000,
    "currency": "EUR",
    "merchant_id": "merchant-001",
    "offer_id": "offer-001",
    "sponsor_id": "sponsor-001"
  },
  "invariants": [
    "replay_safe",
    "balanced"
  ],
  "kind": "neutrino.test-realization",
  "ledgerDeltas": {
    "merchant.expected_contribution": 5000,
    "sponsor.commitment": -5000
  },
  "procedure": "core_role_constrained",
  "scenario": "core_role_constrained_happy_path",
  "schemaVersion": 1
}
