{
  "capabilityHash": "7bdeabc4830bf4f66967eb7b12b738b32a340ed5c3e9acb3b44dd8e5c3148a64",
  "computed": {},
  "eventChain": [
    "ComputeJobRequested",
    "RequesterBountyDebited",
    "CoreEscrowCredited",
    "CoreHybridComputeSampleReconciled"
  ],
  "inputs": {
    "bounty": 1000,
    "core_id": "core-001",
    "currency": "EUR",
    "job_id": "job-001",
    "requester_id": "requester-001"
  },
  "invariants": [
    "replay_safe",
    "balanced"
  ],
  "kind": "neutrino.test-realization",
  "ledgerDeltas": {
    "core.escrow": 1000,
    "requester.bounty": -1000
  },
  "procedure": "core_hybrid_compute_sample",
  "scenario": "core_hybrid_compute_sample_happy_path",
  "schemaVersion": 1
}
