{
  "capabilityHash": "2908429962da23d33a8004ea2c7a01b5e4cd279895b9860510bc3884c5eaf6aa",
  "computed": {
    "subsidy": 10000
  },
  "eventChain": [
    "PurchaseFinanced",
    "SubsidyComputed",
    "MerchantSubsidyDebited",
    "IssuerReceivableCredited",
    "CoreSampleInstallmentReconciled"
  ],
  "inputs": {
    "currency": "EUR",
    "issuer_id": "issuer-001",
    "merchant_id": "merchant-001",
    "principal": 100000,
    "subsidy_pct": 10,
    "transaction_id": "txn-001"
  },
  "invariants": [
    "replay_safe",
    "balanced"
  ],
  "kind": "neutrino.test-realization",
  "ledgerDeltas": {
    "acquirer.merchant_balance": -10000,
    "issuer.promotional_receivable": 10000
  },
  "procedure": "core_sample_installment",
  "scenario": "core_sample_installment_happy_path",
  "schemaVersion": 1
}
