{
  "capabilityHash": "300394cd718cde7cf1c6d950413d5128aa860d4b32374542d42b8e64525bf4ff",
  "computed": {},
  "eventChain": [
    "SponsoredOfferProposed",
    "SponsorCommitmentDebited",
    "MerchantExpectedContributionCredited",
    "CoreFlexibleBindingReconciled"
  ],
  "inputs": {
    "contribution": 5000,
    "currency": "EUR",
    "merchant_id": "merchant-001",
    "offer_id": "offer-001",
    "sponsor_id": "sponsor-001"
  },
  "invariants": [
    "replay_safe",
    "balanced"
  ],
  "kind": "neutrino.test-realization",
  "ledgerDeltas": {
    "merchant.expected_contribution": 5000,
    "sponsor.commitment": -5000
  },
  "procedure": "core_flexible_binding",
  "scenario": "core_flexible_binding_happy_path",
  "schemaVersion": 1
}
